{
  "$schema":"https://json-schema.org/draft/2020-12/schema","$id":"https://example.invalid/aica/schemas/assurance-lifecycle.schema.json","title":"Assurance Lifecycle Bundle","type":"object","required":["run_id","observations","findings","risks","exceptions","remediations","retests","review_decisions"],"additionalProperties":false,"properties":{"$schema":{"type":"string"},"run_id":{"type":"string","format":"uuid"},"observations":{"type":"array","items":{"$ref":"core-contracts.schema.json#/$defs/observation"}},"findings":{"type":"array","items":{"$ref":"core-contracts.schema.json#/$defs/finding"}},"risks":{"type":"array","items":{"$ref":"core-contracts.schema.json#/$defs/risk"}},"exceptions":{"type":"array","items":{"$ref":"core-contracts.schema.json#/$defs/exception"}},"remediations":{"type":"array","items":{"$ref":"core-contracts.schema.json#/$defs/remediation"}},"retests":{"type":"array","items":{"$ref":"core-contracts.schema.json#/$defs/retest"}},"review_decisions":{"type":"array","items":{"$ref":"core-contracts.schema.json#/$defs/reviewDecision"}}}
}
