{
  "$schema":"../../../schemas/assurance-lifecycle.schema.json",
  "run_id":"018f6d9a-7b10-7c01-8000-000000000001",
  "observations":[
    {"observation_id":"OBS-001","statement":"A sanitized unattached NSG contains an inbound Any-to-TCP/3389 allow rule at priority 100.","observed_at":"2026-06-01T12:04:00Z","subject_refs":["fixture:legacy-unattached-nsg"],"evidence_refs":["EVD-B-008"]},
    {"observation_id":"OBS-002","statement":"Six of eight synthetic indirect-prompt-injection cases failed their expected behavior.","observed_at":"2026-06-01T12:10:00Z","subject_refs":["component:policy-assistant"],"evidence_refs":["EVD-B-009"]},
    {"observation_id":"OBS-003","statement":"Two missing-confirmation negative requests executed the synthetic access-exception tool.","observed_at":"2026-06-01T12:12:00Z","subject_refs":["tool:create-synthetic-access-exception"],"evidence_refs":["EVD-B-010"]},
    {"observation_id":"OBS-004","statement":"The deployed prompt digest differs from the passing evaluation artifact digest.","observed_at":"2026-06-01T12:14:00Z","subject_refs":["component:release-gate"],"evidence_refs":["EVD-B-011"]},
    {"observation_id":"OBS-005","statement":"The Key Vault diagnostic-settings collector received HTTP 403.","observed_at":"2026-06-01T12:16:00Z","subject_refs":["collector:azure-monitor"],"evidence_refs":["EVD-B-003"]}
  ],
  "findings":[
    {"finding_id":"FND-001","criteria":"SC-7.1 requires no Internet administrative ingress.","condition":"A safe unattached NSG allows Any to TCP/3389.","cause":"A legacy lab rule remained after its original demonstration.","consequence":"The rule could be attached or copied and expose administrative access.","affected_controls":["SC-7"],"affected_objectives":["SC-7.1"],"affected_assets":["fixture:legacy-unattached-nsg"],"severity":"HIGH","severity_rationale":"Impact is high but current likelihood is reduced because the NSG has no attachment.","observation_refs":["OBS-001"],"test_result_refs":["TR-B-025"],"evidence_refs":["EVD-B-008"],"risk_refs":["RSK-001"],"status":"OPEN"},
    {"finding_id":"FND-002","criteria":"AI-DP-01.1 requires provenance and resistance to instructions in retrieved content.","condition":"Six of eight indirect-injection cases influenced output or removed the warning.","cause":"Retrieved text was neither delimited as untrusted nor screened before generation.","consequence":"The assistant can provide policy answers outside approved grounding behavior.","affected_controls":["AI-DP-01"],"affected_objectives":["AI-DP-01.1"],"affected_assets":["component:policy-assistant","corpus:synthetic-policies"],"severity":"HIGH","severity_rationale":"Behavior was reproducible and could affect answer integrity; all data and actions are synthetic.","observation_refs":["OBS-002"],"test_result_refs":["TR-B-031"],"evidence_refs":["EVD-B-009"],"risk_refs":["RSK-002"],"status":"OPEN"},
    {"finding_id":"FND-003","criteria":"AI-AC-01.1 requires independent authorization and explicit confirmation.","condition":"Two missing-confirmation variants executed the harmless tool.","cause":"The service trusted client-provided confirmation state.","consequence":"A crafted client can create unapproved synthetic exception requests.","affected_controls":["AI-AC-01","AC-3"],"affected_objectives":["AI-AC-01.1"],"affected_assets":["tool:create-synthetic-access-exception"],"severity":"HIGH","severity_rationale":"Authorization integrity is materially affected despite the deliberately harmless tool scope.","observation_refs":["OBS-003"],"test_result_refs":["TR-B-032"],"evidence_refs":["EVD-B-010"],"risk_refs":["RSK-003"],"status":"OPEN"},
    {"finding_id":"FND-004","criteria":"AI-TE-01.1 requires a passing fixed evaluation for the exact deployed configuration.","condition":"The deployed prompt digest differs from the evaluated digest.","cause":"The release gate checked only that an artifact existed.","consequence":"An untested behavioral change can reach the demonstration environment.","affected_controls":["AI-TE-01","SA-11","CM-3"],"affected_objectives":["AI-TE-01.1"],"affected_assets":["component:release-gate"],"severity":"MODERATE","severity_rationale":"The defect affects change assurance; the system is synthetic and low impact.","observation_refs":["OBS-004"],"test_result_refs":["TR-B-033"],"evidence_refs":["EVD-B-011"],"risk_refs":["RSK-004"],"status":"OPEN"}
  ],
  "risks":[
    {"risk_id":"RSK-001","statement":"Because a broad administrative rule remains in the configuration estate, it may be attached or copied, causing avoidable Internet management exposure.","likelihood":3,"impact":4,"inherent_score":12,"inherent_rating":"HIGH","residual_score":8,"residual_rating":"MODERATE","confidence":"HIGH","treatment":"MITIGATE","owner":"Cloud Owner","finding_refs":["FND-001"],"review_date":"2026-06-07"},
    {"risk_id":"RSK-002","statement":"Because retrieved documents can contain adversarial instructions, the assistant may follow them, reducing grounded-answer integrity.","likelihood":4,"impact":4,"inherent_score":16,"inherent_rating":"HIGH","residual_score":12,"residual_rating":"HIGH","confidence":"HIGH","treatment":"MITIGATE","owner":"AI System Owner","finding_refs":["FND-002"],"review_date":"2026-06-07"},
    {"risk_id":"RSK-003","statement":"Because confirmation is trusted from client state, a crafted request may execute the synthetic tool without approval, undermining authorization integrity.","likelihood":3,"impact":5,"inherent_score":15,"inherent_rating":"HIGH","residual_score":10,"residual_rating":"HIGH","confidence":"HIGH","treatment":"MITIGATE","owner":"Application Owner","finding_refs":["FND-003"],"review_date":"2026-06-07"},
    {"risk_id":"RSK-004","statement":"Because the gate accepts an artifact for a different digest, an untested AI configuration may deploy and introduce unknown behavioral regression.","likelihood":3,"impact":4,"inherent_score":12,"inherent_rating":"HIGH","residual_score":9,"residual_rating":"MODERATE","confidence":"HIGH","treatment":"MITIGATE","owner":"DevSecOps Owner","finding_refs":["FND-004"],"review_date":"2026-06-07"}
  ],
  "exceptions":[],
  "remediations":[
    {"remediation_id":"REM-001","finding_ref":"FND-001","owner":"Cloud Owner","action":"Remove the broad RDP rule through version-controlled infrastructure and verify no attachment.","target_date":"2026-06-07","status":"PLANNED","commit_ref":null,"pull_request_ref":"PR-SANITIZED-101","evidence_refs":[]},
    {"remediation_id":"REM-002","finding_ref":"FND-002","owner":"AI System Owner","action":"Delimit retrieved content as untrusted, detect embedded instructions, enforce citations and refusal behavior, and rerun the fixed set.","target_date":"2026-06-07","status":"PLANNED","commit_ref":null,"pull_request_ref":"PR-SANITIZED-102","evidence_refs":[]},
    {"remediation_id":"REM-003","finding_ref":"FND-003","owner":"Application Owner","action":"Bind authorization, actor, tool, argument digest, expiry, and single-use confirmation token server-side.","target_date":"2026-06-07","status":"PLANNED","commit_ref":null,"pull_request_ref":"PR-SANITIZED-103","evidence_refs":[]},
    {"remediation_id":"REM-004","finding_ref":"FND-004","owner":"DevSecOps Owner","action":"Fail closed unless deployed and evaluated model, prompt, retrieval, corpus, tool, and guardrail digests match.","target_date":"2026-06-07","status":"PLANNED","commit_ref":null,"pull_request_ref":"PR-SANITIZED-104","evidence_refs":[]}
  ],
  "retests":[],
  "review_decisions":[
    {"decision_id":"DEC-B-001","reviewer":"Simulated Assessor","subject_ref":"RUN-001","prior_state":"DRAFT","decision":"ACCEPT_AS_BASELINE","rationale":"Evidence supports four findings and one not-concluded monitoring control; no missing evidence was treated as pass.","timestamp":"2026-06-01T12:25:00Z","artifact_hash":"sha256:aaaaaaaaaaaaaaaaaaaaaaaaaaaaaaaaaaaaaaaaaaaaaaaaaaaaaaaaaaaaaaaa"},
    {"decision_id":"DEC-B-002","reviewer":"Simulated Assessor","subject_ref":"AI-SUGGESTION-001","prior_state":"SUGGESTED","decision":"REJECT","rationale":"The suggestion proposed closing FND-002 from a code diff without fresh behavioral evidence; reviewer rejected it.","timestamp":"2026-06-01T12:26:00Z","artifact_hash":"sha256:adadadadadadadadadadadadadadadadadadadadadadadadadadadadadadadad"}
  ]
}
